{
  "$schema": "https://json-schema.org/draft/2020-12/schema",
  "$id": "https://github.com/n1hub/specs/schemas/public-ecosystem-value-map.schema.json",
  "title": "Public Ecosystem Value Map",
  "type": "object",
  "additionalProperties": false,
  "required": [
    "version",
    "reviewed_at",
    "purpose",
    "value_families",
    "non_claims",
    "review_commands"
  ],
  "properties": {
    "version": {
      "type": "string"
    },
    "reviewed_at": {
      "type": "string"
    },
    "purpose": {
      "type": "string"
    },
    "value_families": {
      "type": "array",
      "minItems": 1,
      "items": {
        "type": "object",
        "additionalProperties": false,
        "required": [
          "id",
          "summary",
          "beneficiaries",
          "strongest_surfaces",
          "supporting_surfaces",
          "verify_commands",
          "bounded_non_goals"
        ],
        "properties": {
          "id": {
            "type": "string"
          },
          "summary": {
            "type": "string"
          },
          "beneficiaries": {
            "type": "array",
            "minItems": 1,
            "items": {
              "type": "string"
            }
          },
          "strongest_surfaces": {
            "type": "array",
            "minItems": 1,
            "items": {
              "type": "string"
            }
          },
          "supporting_surfaces": {
            "type": "array",
            "minItems": 1,
            "items": {
              "type": "string"
            }
          },
          "verify_commands": {
            "type": "array",
            "minItems": 1,
            "items": {
              "type": "string"
            }
          },
          "bounded_non_goals": {
            "type": "array",
            "minItems": 1,
            "items": {
              "type": "string"
            }
          }
        }
      }
    },
    "non_claims": {
      "type": "array",
      "minItems": 1,
      "items": {
        "type": "string"
      }
    },
    "review_commands": {
      "type": "array",
      "minItems": 1,
      "items": {
        "type": "string"
      }
    }
  }
}
